{
  "schemaVersion": "c3-exploration-execution-contract.v1",
  "contractVersion": "1.0.0",
  "analysisId": "c3-c2-pilot-exploration",
  "status": "EXPLORATORY_NON_AUTHORITATIVE",
  "c2ReviewTarget": {
    "commit": "42adf110c1d8e8f01932b8b9b5f97a1e086d0343",
    "normalizedObservationStatus": "PILOT_NON_AUTHORITATIVE_PARTIAL",
    "inputArtifacts": [
      {
        "path": "data/calibration/pilot/normalized_observations.v1.json",
        "sha256": "2ddf22030106f92b906510b926bf40855e8879e5faca67d43ed9ade31cb6078a"
      },
      {
        "path": "data/calibration/pilot/quality_diagnostics.v1.json",
        "sha256": "e4b4c07136f94992d63813ee34b6cf0111ee7953dab39fc964167e86f96e9b8a"
      },
      {
        "path": "data/calibration/pilot/snapshot_manifest.v1.json",
        "sha256": "bcdf0cefe0d6e6ac6b223198a5e076d4228fcaff354fe203c26f7343323bf8fa"
      },
      {
        "path": "data/calibration/pilot/pilot_report.v1.json",
        "sha256": "3c8fe27f685b001ecfe73476fddf85ec32a71b1b239d70aad73ccf76d2c56a21"
      }
    ],
    "requiredProviderTruth": {
      "WTO_TIMESERIES_V1": "NOT_FETCHED/WTO_API_KEY_MISSING",
      "UN_COMTRADE_V1": "PUBLIC_PREVIEW_PILOT_ONLY",
      "WB_WDI_V2": "LIVE_PILOT_ONLY"
    }
  },
  "coverageScopes": [
    {
      "scopeId": "WDI_GRID_10_ENTITIES_3_PERIODS",
      "variableIds": [
        "gdp_current_usd",
        "real_gdp_growth_pct",
        "population_total",
        "inflation_consumer_pct",
        "unemployment_pct",
        "agriculture_value_added_pct_gdp",
        "manufacturing_value_added_pct_gdp",
        "services_value_added_pct_gdp"
      ],
      "expectedEntityIds": [
        "emp:AUS",
        "emp:BRA",
        "emp:CHN",
        "emp:DEU",
        "emp:IDN",
        "emp:IND",
        "emp:JPN",
        "emp:MEX",
        "emp:USA",
        "emp:ZAF"
      ],
      "expectedPeriods": ["2021", "2022", "2023"],
      "coverageDenominatorPolicy": "EXPLICIT_EXPECTED_GRID"
    },
    {
      "scopeId": "COMTRADE_SPARSE_REQUESTED_SLICE",
      "variableIds": [
        "bilateral_trade_exports_usd",
        "bilateral_trade_imports_usd"
      ],
      "coverageDenominatorPolicy": "NOT_DEFINED_FOR_SPARSE_REQUESTED_SLICE"
    }
  ],
  "qualityTreatment": {
    "missingness": "PRESERVE_EXPLICIT_NULLS_NO_IMPUTATION",
    "duplicateObservationIds": "RETAIN_SOURCE_FACT_COUNT_EXCLUDE_EXACT_DUPLICATES_FROM_UNIVARIATE_DISTRIBUTION",
    "reportingAsymmetry": "RETAIN_SEPARATE_REPORTER_AND_MIRROR_FACTS_NO_AVERAGING_NO_RECONCILIATION",
    "unitCaveat": "NO_UNIT_RESCALING_WHEN_PROVIDER_UNIT_METADATA_IS_EMPTY",
    "revisionCaveat": "DO_NOT_INFER_STABILITY_WITHOUT_A_SECOND_PROVIDER_VINTAGE"
  },
  "statisticalScope": {
    "mode": "DESCRIPTIVE_EXPLORATION_ONLY",
    "prohibited": [
      "P_VALUE_OR_CONFIDENCE_INTERVAL_CLAIMS",
      "ARCHETYPE_ALGORITHM_OR_COUNT_SELECTION",
      "FICTIONAL_COUNTRY_MAPPING",
      "IPF_RAS_OR_TRADE_RECONCILIATION",
      "FINAL_CALIBRATION_OR_RUNTIME_PARAMETERIZATION"
    ],
    "reason": "The C2 pilot is a bounded, non-random, incomplete empirical slice rather than an inferential sample."
  },
  "transformation": {
    "transformationId": "C3_EXPLORATION_DISTRIBUTION_COVERAGE",
    "transformationVersion": "1.0.0",
    "quantileMethod": "NEAREST_RANK_V1",
    "arithmeticPolicy": "EXACT_DECIMAL_OR_EXACT_RATIONAL_NO_ROUNDING",
    "ordering": "VARIABLE_ID_SUMMARIES; DISTRIBUTION_CANONICAL_DECIMAL_ASCENDING_THEN_OBSERVATION_ID; IDENTIFIER_LISTS_CODE_UNIT_ASCENDING"
  },
  "hardBoundaries": [
    "NO_LIVE_PROVIDER_NETWORK_RETRIEVAL",
    "NO_WORLD_CORE_OR_RUNTIME_IMPORT",
    "NO_WORLD_STATE_EVENT_INVENTORY_FINANCIAL_OR_V09_MUTATION",
    "NO_SUPABASE_OR_PRODUCTION_DATABASE_ACCESS",
    "NO_FINAL_70_COUNTRY_PACKAGE"
  ]
}
